[
  {
    "id": "OBJ-2026-0001",
    "name": "Obsidian",
    "slug": "obsidian",
    "aliases": [],
    "summary": "Local-first Markdown knowledge base with bidirectional links.",
    "detail": "",
    "purpose": "External memory / note store \u2014 primary thinking substrate.",
    "function": "Bidirectional-link Markdown editing over local vault files.",
    "object_kind": "software_tool",
    "category": "note-taking",
    "domain": "Knowledge Management",
    "keywords": [
      "note-taking"
    ],
    "tags": [
      "daily-driver",
      "pkm"
    ],
    "provenance": {
      "source_url": "https://obsidian.md",
      "vendor": "Obsidian",
      "version": "1.7.4",
      "license": "proprietary",
      "acquired_at": "2027-04-25T00:00:00Z"
    },
    "status": "active",
    "priority": "critical",
    "owner": "self",
    "workflow_state": "adopted",
    "lifecycle_state": "active",
    "hosting_model": "local",
    "access_model": "free",
    "cost": {
      "kind": "free",
      "currency": null,
      "amount": null,
      "period": null,
      "notes": null
    },
    "usage": {
      "interface": "gui",
      "install": "AppImage download",
      "config": null,
      "docs_url": "https://help.obsidian.md",
      "invocation": "obsidian"
    },
    "epistemic": {
      "fit_confidence": "high",
      "evidence_level": "established",
      "rating": 4.5
    },
    "strategic": {
      "system_served": "system_4_intelligence",
      "goal": null,
      "objective": null,
      "capability": "note-taking",
      "initiative": null
    },
    "relations": [
      {
        "target": "OBJ-2026-0003",
        "kind": "integrates_with",
        "notes": "Vault versioned in git"
      },
      {
        "target": "OBJ-2026-0021",
        "kind": "integrates_with",
        "notes": "Export notes via pandoc"
      },
      {
        "target": "OBJ-2026-0008",
        "kind": "complements",
        "notes": "Papers feed the vault"
      }
    ],
    "annotations": [
      {
        "id": "ann-0001",
        "created_at": "2027-03-16T00:00:00Z",
        "author": "self",
        "kind": "comment",
        "text": "Switched to local-first after Notion sync issues.",
        "state": "resolved"
      },
      {
        "id": "ann-0002",
        "created_at": "2026-06-20T10:30:00Z",
        "author": "self",
        "kind": "review",
        "text": "Still the best daily driver; plugins stable.",
        "state": "open"
      }
    ],
    "created_at": "2027-04-25T00:00:00Z",
    "updated_at": "2027-04-25T00:00:00Z",
    "last_used_at": "2026-06-26T10:30:00Z"
  },
  {
    "id": "OBJ-2026-0002",
    "name": "VS Code",
    "slug": "vs-code",
    "aliases": [],
    "summary": "Extensible source-code editor.",
    "detail": "",
    "purpose": "Primary development environment.",
    "function": "Text editing, debugging, extensions, integrated terminal.",
    "object_kind": "software_tool",
    "category": "code-editor",
    "domain": "Software Engineering",
    "keywords": [
      "code-editor"
    ],
    "tags": [
      "daily-driver",
      "editor"
    ],
    "provenance": {
      "source_url": "https://code.visualstudio.com",
      "vendor": "Microsoft",
      "version": "1.99",
      "license": "MIT",
      "acquired_at": "2027-10-02T00:00:00Z"
    },
    "status": "active",
    "priority": "critical",
    "owner": "self",
    "workflow_state": "adopted",
    "lifecycle_state": "active",
    "hosting_model": "local",
    "access_model": "free",
    "cost": {
      "kind": "free",
      "currency": null,
      "amount": null,
      "period": null,
      "notes": null
    },
    "usage": {
      "interface": "gui",
      "install": "apt install code",
      "config": null,
      "docs_url": "https://code.visualstudio.com/docs",
      "invocation": "code"
    },
    "epistemic": {
      "fit_confidence": "high",
      "evidence_level": "established",
      "rating": 4.5
    },
    "strategic": {
      "system_served": "system_1_operations",
      "goal": null,
      "objective": null,
      "capability": "code-editor",
      "initiative": null
    },
    "relations": [
      {
        "target": "OBJ-2026-0003",
        "kind": "depends_on",
        "notes": "Editor calls git"
      }
    ],
    "annotations": [],
    "created_at": "2027-10-02T00:00:00Z",
    "updated_at": "2027-10-02T00:00:00Z",
    "last_used_at": "2026-06-27T10:30:00Z"
  },
  {
    "id": "OBJ-2026-0003",
    "name": "git",
    "slug": "git",
    "aliases": [],
    "summary": "Distributed version control system.",
    "detail": "",
    "purpose": "Track change history of text artifacts.",
    "function": "Commit, branch, merge, and synchronize repositories.",
    "object_kind": "software_tool",
    "category": "version-control",
    "domain": "Software Engineering",
    "keywords": [
      "version-control"
    ],
    "tags": [
      "daily-driver",
      "vcs"
    ],
    "provenance": {
      "source_url": "https://git-scm.com",
      "vendor": "Git project",
      "version": "2.45",
      "license": "GPL-2.0",
      "acquired_at": "2028-01-10T00:00:00Z"
    },
    "status": "active",
    "priority": "critical",
    "owner": "self",
    "workflow_state": "adopted",
    "lifecycle_state": "active",
    "hosting_model": "local",
    "access_model": "open",
    "cost": {
      "kind": "free",
      "currency": null,
      "amount": null,
      "period": null,
      "notes": null
    },
    "usage": {
      "interface": "cli",
      "install": "apt install git",
      "config": null,
      "docs_url": "https://git-scm.com/docs",
      "invocation": "git"
    },
    "epistemic": {
      "fit_confidence": "high",
      "evidence_level": "established",
      "rating": 5
    },
    "strategic": {
      "system_served": "system_1_operations",
      "goal": null,
      "objective": null,
      "capability": "version-control",
      "initiative": null
    },
    "relations": [],
    "annotations": [],
    "created_at": "2028-01-10T00:00:00Z",
    "updated_at": "2028-01-10T00:00:00Z",
    "last_used_at": "2026-06-27T10:30:00Z"
  },
  {
    "id": "OBJ-2026-0004",
    "name": "Flask",
    "slug": "flask",
    "aliases": [],
    "summary": "Lightweight Python WSGI web framework.",
    "detail": "",
    "purpose": "Serve mock APIs and prototypes for Autoregia tools.",
    "function": "Routing, request/response, JSON serialization.",
    "object_kind": "library_framework",
    "category": "web-framework",
    "domain": "Software Engineering",
    "keywords": [
      "web-framework"
    ],
    "tags": [
      "backend"
    ],
    "provenance": {
      "source_url": "https://flask.palletsprojects.com",
      "vendor": "Pallets",
      "version": "3.0",
      "license": "BSD-3-Clause",
      "acquired_at": "2026-03-01T00:00:00Z"
    },
    "status": "active",
    "priority": "high",
    "owner": "self",
    "workflow_state": "adopted",
    "lifecycle_state": "active",
    "hosting_model": "self_hosted",
    "access_model": "open",
    "cost": {
      "kind": "free",
      "currency": null,
      "amount": null,
      "period": null,
      "notes": null
    },
    "usage": {
      "interface": "library",
      "install": "pip install flask",
      "config": null,
      "docs_url": "https://flask.palletsprojects.com",
      "invocation": "from flask import Flask"
    },
    "epistemic": {
      "fit_confidence": "high",
      "evidence_level": "experimental",
      "rating": 4
    },
    "strategic": {
      "system_served": "system_1_operations",
      "goal": null,
      "objective": null,
      "capability": "web-framework",
      "initiative": null
    },
    "relations": [
      {
        "target": "OBJ-2026-0010",
        "kind": "depends_on",
        "notes": "Catalog stored in SQLite"
      },
      {
        "target": "OBJ-2026-0007",
        "kind": "integrates_with",
        "notes": "Mirrors repos to GitHub"
      }
    ],
    "annotations": [],
    "created_at": "2026-03-01T00:00:00Z",
    "updated_at": "2026-06-25T10:30:00Z",
    "last_used_at": "2026-06-25T10:30:00Z"
  },
  {
    "id": "OBJ-2026-0005",
    "name": "Apache ECharts",
    "slug": "apache-echarts",
    "aliases": [],
    "summary": "Declarative data-visualization library.",
    "detail": "",
    "purpose": "Render analytical charts for the Statistical Overlay.",
    "function": "Bar, pie, graph, and treemap visualizations from data.",
    "object_kind": "library_framework",
    "category": "charting",
    "domain": "Data Science",
    "keywords": [
      "charting"
    ],
    "tags": [
      "viz"
    ],
    "provenance": {
      "source_url": "https://echarts.apache.org",
      "vendor": "Apache",
      "version": "5.5",
      "license": "Apache-2.0",
      "acquired_at": "2026-01-30T00:00:00Z"
    },
    "status": "active",
    "priority": "medium",
    "owner": "self",
    "workflow_state": "adopted",
    "lifecycle_state": "active",
    "hosting_model": "self_hosted",
    "access_model": "open",
    "cost": {
      "kind": "free",
      "currency": null,
      "amount": null,
      "period": null,
      "notes": null
    },
    "usage": {
      "interface": "library",
      "install": "npm install echarts",
      "config": null,
      "docs_url": "https://echarts.apache.org/en/option.html",
      "invocation": "echarts.init(dom)"
    },
    "epistemic": {
      "fit_confidence": "high",
      "evidence_level": "observational",
      "rating": 4
    },
    "strategic": {
      "system_served": "system_4_intelligence",
      "goal": null,
      "objective": null,
      "capability": "charting",
      "initiative": null
    },
    "relations": [
      {
        "target": "OBJ-2026-0004",
        "kind": "integrates_with",
        "notes": "Charts served by Flask app"
      },
      {
        "target": "OBJ-2026-0002",
        "kind": "depends_on",
        "notes": "Developed in VS Code"
      }
    ],
    "annotations": [],
    "created_at": "2026-01-30T00:00:00Z",